{
  "schema_version": "1.0.0",
  "id": "two-sum",
  "title": "Two Sum",
  "difficulty": "easy",
  "topics": ["arrays", "hashing"],
  "prerequisites": ["arrays-basics"],
  "statement": "Given an array of integers `nums` and an integer `target`, return the indices of the two numbers such that they add up to `target`.\n\nYou may assume each input has exactly one solution, and you may not use the same element twice.\n\nReturn the answer as two space-separated indices (0-indexed) in any order.",
  "examples": [
    {
      "input": "4\n2 7 11 15\n9",
      "output": "0 1",
      "explanation": "nums[0] + nums[1] = 2 + 7 = 9."
    },
    {
      "input": "3\n3 2 4\n6",
      "output": "1 2"
    }
  ],
  "constraints": [
    "2 <= n <= 10^4",
    "-10^9 <= nums[i] <= 10^9",
    "Exactly one valid answer exists"
  ],
  "execution": {
    "time_limit_ms": 2000,
    "memory_limit_kb": 262144,
    "supported_languages": ["python", "javascript", "cpp"],
    "stdin_mode": "lines",
    "comparison": "trimmed"
  },
  "test_cases": [
    { "id": "pub-1", "is_public": true, "input": "4\n2 7 11 15\n9", "expected_output": "0 1" },
    { "id": "pub-2", "is_public": true, "input": "3\n3 2 4\n6", "expected_output": "1 2" },
    { "id": "hid-1", "is_public": false, "input": "2\n3 3\n6", "expected_output": "0 1" }
  ],
  "hints": [
    { "order": 1, "text": "A brute force double loop works but is slow for large n." },
    { "order": 2, "text": "Store each value's index in a hash map while scanning once." }
  ],
  "editorial": "Use a hash map from value to index. For each element x, check if target - x was seen before.",
  "provenance": { "source": "seed", "author": "SAIT DSA" },
  "review_status": "published",
  "reference_solutions": {
    "python": "import sys\ndata = sys.stdin.read().strip().split()\nn = int(data[0])\nnums = list(map(int, data[1:1+n]))\ntarget = int(data[1+n])\nseen = {}\nfor i, v in enumerate(nums):\n    if target - v in seen:\n        print(seen[target - v], i)\n        break\n    seen[v] = i\n"
  }
}
