{
  "schema_version": "1.0.0",
  "id": "max-subarray",
  "title": "Maximum Subarray Sum",
  "difficulty": "medium",
  "topics": ["arrays", "dynamic-programming"],
  "statement": "Given an integer array `nums`, find the contiguous subarray with the largest sum and return that sum.",
  "examples": [
    { "input": "-2 1 -3 4 -1 2 1 -5 4", "output": "6", "explanation": "Subarray [4,-1,2,1] has sum 6." }
  ],
  "constraints": ["1 <= nums.length <= 10^5"],
  "execution": {
    "time_limit_ms": 2000,
    "memory_limit_kb": 262144,
    "supported_languages": ["python", "javascript", "cpp"],
    "comparison": "trimmed"
  },
  "test_cases": [
    { "id": "pub-1", "is_public": true, "input": "-2 1 -3 4 -1 2 1 -5 4", "expected_output": "6" },
    { "id": "hid-1", "is_public": false, "input": "1", "expected_output": "1" }
  ],
  "hints": [
    { "order": 1, "text": "Kadane's algorithm tracks the best ending here." }
  ],
  "review_status": "published",
  "reference_solutions": {
    "python": "nums = list(map(int, input().split()))\nbest = cur = nums[0]\nfor x in nums[1:]:\n    cur = max(x, cur + x)\n    best = max(best, cur)\nprint(best)\n"
  }
}
