{
  "schema_version": "1.0.0",
  "id": "valid-parentheses",
  "title": "Valid Parentheses",
  "difficulty": "easy",
  "topics": ["stacks", "strings"],
  "statement": "Given a string `s` containing only `(`, `)`, `{`, `}`, `[` and `]`, determine if the input string is valid.\n\nAn input string is valid if open brackets are closed in the correct order.",
  "examples": [
    { "input": "()", "output": "true" },
    { "input": "()[]{}", "output": "true" },
    { "input": "(]", "output": "false" }
  ],
  "constraints": ["1 <= s.length <= 10^4"],
  "execution": {
    "time_limit_ms": 1000,
    "memory_limit_kb": 131072,
    "supported_languages": ["python", "javascript", "cpp"],
    "comparison": "trimmed"
  },
  "test_cases": [
    { "id": "pub-1", "is_public": true, "input": "()", "expected_output": "true" },
    { "id": "pub-2", "is_public": true, "input": "(]", "expected_output": "false" },
    { "id": "hid-1", "is_public": false, "input": "([{}])", "expected_output": "true" }
  ],
  "hints": [
    { "order": 1, "text": "Use a stack to track opening brackets." }
  ],
  "review_status": "published",
  "reference_solutions": {
    "python": "s = input().strip()\nstack = []\npairs = {')': '(', ']': '[', '}': '{'}\nfor ch in s:\n    if ch in '([{':\n        stack.append(ch)\n    elif not stack or stack.pop() != pairs[ch]:\n        print('false')\n        exit()\nprint('true' if not stack else 'false')\n"
  }
}
